{
  "drift_id": "drift-291e3dce52a6",
  "claim_observation": "claim-344248b0587a",
  "evidence": "ev-260486687067",
  "difference": "Absent self-declaration: REPO_BOUNDARIES.md asserts agent-internet role: Control Plane + Projection but agent-internet/.well-known/agent-federation.json has no role or owner_boundary field",
  "detected_at": "2026-08-02T04:07:05Z"
}
